{
  "$schema": "../../../app/schemas/reference-point-cloud-chunk.schema.json",
  "schema": "bobercad-reference-point-cloud-chunk",
  "schemaVersion": "0.1.0",
  "id": "sample_reference_scan_chunk_1",
  "kind": "point-cloud",
  "objectId": "reference_scan_points_chunked",
  "pointCount": 12,
  "bounds": {
    "min": [
      -760,
      -360,
      18
    ],
    "max": [
      760,
      360,
      150
    ]
  },
  "points": [
    [
      -760,
      -360,
      18
    ],
    [
      -610,
      -320,
      46
    ],
    [
      -360,
      -350,
      72
    ],
    [
      -90,
      -330,
      118
    ],
    [
      210,
      -340,
      96
    ],
    [
      510,
      -310,
      60
    ],
    [
      760,
      -280,
      28
    ],
    [
      -690,
      340,
      44
    ],
    [
      -340,
      360,
      88
    ],
    [
      20,
      330,
      150
    ],
    [
      410,
      350,
      104
    ],
    [
      720,
      300,
      52
    ]
  ],
  "pointAttributes": {
    "intensities": [
      0.16,
      0.21,
      0.29,
      0.44,
      0.52,
      0.35,
      0.19,
      0.24,
      0.41,
      0.58,
      0.5,
      0.32
    ]
  },
  "metadata": {
    "sourceEntity": "E57-POINT-CHUNK-SAMPLE"
  }
}
